CertificationNO,Provider Name,State
317001,VNA OF SOMERSET HILLS - HOME HEALTH,NJ
317002,VISITING NURSE ASSOC OF NORTHERN NEW JERSEY,NJ
317006,BAYONNE VISITING NURSE ASSOCIATION,NJ
317008,VALLEY HOME CARE INC.,NJ
317009,CHRILL VISITING NURSE ASSOCIATION,NJ
317012,CAPE REGIONAL HOME HEALTH CARE LLC,NJ
317016,VNA HOME CARE OF MERCER COUNTY,NJ
317017,PATIENT CARE NEW JERSEY INC,NJ
317020,HOLY REDEEMER HOME CARE NJ NORTH,NJ
317021,VISITING NURSE ASSOC OF CENTRAL JERSEY,NJ
317022,VISITING NURSE ASSOCIATION OF ENGLEWOOD,NJ
317023,COMMUNITY VNA,NJ
317025,HOLY REDEEMER HOME CARE,NJ
317031,BAYADA HOME HEALTH CARE INC,NJ
317035,VIRTUA HOME CARE - COMMUNITY NURSING SERVICES,NJ
317043,HUNTERDON MEDICAL CENTER HOME HEALTH,NJ
317045,PRINCETON HOMECARE SERVICES PRINCETON HEALTH CARE,NJ
317047,HOME HEALTH SERVICES OF HACKENSACK,NJ
317048,MOORESTOWN VISITING NURSE ASSOCIATION,NJ
317050,BAYADA HOME HEALTH CARE INC,NJ
317051,COMMUNITY NURSING SERVICE,NJ
317054,ATLANTIC HOME CARE & HOSPICE,NJ
317056,WARREN COUNTY PUBLIC HEALTH NURSING AGENCY,NJ
317058,VISITING HEALTH SERVICES OF NEW JERSEY,NJ
317059,JFK AT HOME,NJ
317060,PATIENT CARE MEDICAL SERVICES INC,NJ
317061,BARNABAS HEALTH HOME CARE AND HOSPICE,NJ
317062,MERCER CARE,NJ
317064,PROMISE CARE NJ LLC,NJ
317065,BAYADA HOME HEALTH CARE INC,NJ
317066,HOLY REDEEMER HOME CARE NJ SHORE,NJ
317067,VNA OF CENTRAL JERSEY HOME CARE & HOSPICE,NJ
317071,VIRTUA HOME CARE AT WEST JERSEY,NJ
317072,ATLANTICARE HOME CARE,NJ
317073,KENNEDY UNIVERSITY HOSPITAL INC HOME HEALTH CARE,NJ
317075,MERIDIAN HOME CARE-OCEAN COUNTY,NJ
317076,PRIME HEALTHCARE SERVICES/ST CLARE'S,NJ
317077,HOLY NAME HOME CARE,NJ
317079,ROBERT WOOD JOHNSON VISITING NURSES INC,NJ
317081,MEMORIAL HOME HEALTH,NJ
317082,ASCEND HOME HEALTH,NJ
317084,MERIDIAN HOME CARE-MONMOUTH CO,NJ
317086,INSPIRA HOME CARE,NJ
317089,TRI-COUNTY HOME AND HOSPICE CARE LLC,NJ
317090,PSA HEALTHCARE,NJ
317092,CEDAR CREST VILLAGE INC HOME HEALTH DEPARTMENT,NJ
317093,SEABROOK HOME HEALTH AGENCY,NJ
